{
    "$schema": "http://json-schema.org/draft-07/schema#",
    "$id": "https://raw.githubusercontent.com/input-output-hk/hermes/main/hermes/schemas/hermes_module_cose_author_payload.schema.json",
    "title": "Hermes WASM Module COSE Payload Schema",
    "description": "Defines the COSE signing payload. A WASM module package specific information which should be cryptographically protected.",
    "type": "object",
    "additionalProperties": false,
    "properties": {
        "metadata": {
            "type": "string",
            "title": "Blake2b hash hex of metadata.json package file",
            "description": "A hex representation of the Blake2b hash of the metadata.json file inside the package.",
            "pattern": "^[0-9a-f]{64}$"
        },
        "component": {
            "type": "string",
            "title": "Blake2b hash hex of module.wasm package file",
            "description": "A hex representation of the Blake2b hash of the module.wasm file inside the package.",
            "pattern": "^[0-9a-f]{64}$"
        },
        "config": {
            "type": "object",
            "title": "WASM Module Config Object.",
            "description": "Object representing the WASM Module Config File.",
            "properties": {
                "file": {
                    "type": "string",
                    "title": "Blake2b hash hex of config.json package file",
                    "description": "A hex representation of the Blake2b hash of the config.json file inside the package.",
                    "pattern": "^[0-9a-f]{64}$"
                },
                "schema": {
                    "type": "string",
                    "title": "Blake2b hash hex of config.schema.json package file",
                    "description": "A hex representation of the Blake2b hash of the config.schema.json file inside the package.",
                    "pattern": "^[0-9a-f]{64}$"
                }
            },
            "required": [
                "schema"
            ]
        },
        "settings": {
            "type": "object",
            "title": "WASM Module Settings Object.",
            "description": "Object representing the WASM Module Settings.",
            "properties": {
                "schema": {
                    "type": "string",
                    "title": "Blake2b hash hex of settings.schema.json package file",
                    "description": "A hex representation of the Blake2b hash of the settings.schema.json file inside the package.",
                    "pattern": "^[0-9a-f]{64}$"
                }
            },
            "required": [
                "schema"
            ]
        },
        "share": {
            "type": "string",
            "title": "Blake2b hash hex of the whole share package directory",
            "description": "A hex representation of the Blake2b hash of the whole share directory inside the package.",
            "pattern": "^[0-9a-f]{64}$"
        }
    },
    "required": [
        "metadata",
        "component"
    ]
}