{
    "metadata": "e6d4ecf4e0df7688f8fb5d564fc6bcafffdfc46bb793631a9ed3bb6d888561df",
    "component": "0cfdb8d790b0a30fb8eb12d98c1791f35a279c0a5f8bf313cd582fc6b8cd69d5",
    "config": {
        "file": "69e66dc097dbd3d3a333c699d05b2c7173d6d9cc7d6a7e35745339e282d70904",
        "schema": "0da53b44f7de08af0743779dfb9448fa32fe3584e9b940ae740a1bbc74741bba"
    },
    "settings": {
        "schema": "9cd493f0cbdb907814b142e22e76fa8cf0e95bcd3117d4c3e7c4cbe4b885d932"
    },
    "share": "ed6ac923cfa79ab05cf2a41dc43493e0f74d8bd7596185be5bce74ffda85d9a5"
}